"Year","Topic","Notes","Exact Date","Citation","Tags"
"1828","Printed catalogue of the 8,000 volumes in the library completed.  Though Jefferson intended his personal library to go to the University it had to be sold to pay debts.","","","chron96",""
"1831-35","William Brokenbrough - third librarian. Let go because of complaints","","","chron96",""
"1835-57","William Wertenbaker once more librarian","","","chron96",""
"1836","Appointment of a Faculty Library Committee to approve library purchases.","","","chron96",""
"1836","James Madison left the library $1,500 which was merged into the general university fund. Only in 1852 did the library get access to the money.","","","chron96",""
"1850-53","Rotunda annex built","","","chron96",""
"1850's","Prosperous period for the University because of high enrollment. Library benefited along with other parts of the university.","","","chron96",""
"1856","Board of Visitors proposed hiring a bibliographer to prepare a ""want list."" The faculty protested and the Board later dropped the idea.","","","chron96",""
"1857-61","Thomas Berkeley Holcombe appointed librarian.","","","chron96",""
"1825-1860","Library grew from 8,000 to 30,000 volumes","","","chron96",""
"1861-65","Robert Riddick Prentis - acting librarian and proctor. The University stayed open during the Civil War, but just barely","","","chron96",""
"1865-1881","Reconstruction - The faculty borrowed money to fix up buildings. New schools opened including Applied Math, Agriculture, and Geology. The library was not equipped to serve the new schools because it lacked the necessary funds.","","","chron96",""
"1929","A committee appointed to study cataloging alternatives recommended the library begin using the Library of Congress classification system as soon as circumstances were favorable.","","","chron96",""
"1938","Alderman Library opens. Build with Public Works Administration funds and money raised by a bond issue.","","Apr. 1938","chron96",""
"1938","(13th) Formal dedication of Alderman Library. Before Alderman opened there were 22 book collections consolidated into three departmental libraries, Engineering, Law, and Medicine, and ten special or laboratory collections, Astronomy, Chemistry, Fine Arts, Geology, Institute for Research in the Social Sciences, Mathematics, Music, Physics, Public Administration and Rural Social Economics","","Jun. 1938","chron96",""
"1933","Library begins cataloging with the LC classification system","","July 1933","chron96",""
"1947","Bibliographical Society of the University of Virginia is organized by Fredson Bowers.","","","chron96",""
"1950-1956","Jack PPreston Dalton - University Librarian","","","chron96",""
"1956-1967","John Cook Wyllie - University Librarian","","","chron96",""
"1960","(30th) Clifton Waller Barrett Library officially presented to the University","","April 1960","chron96",""
"1967-93","Ray W. Frantz, Jr. - University Librarian","","","chron96",""
"1967","New Stacks addition completed","","","chron96",""
"1968","Manual door check of books and bags begun","","Feb. 1968","chron96",""
"1968","By 1968 seventeen members had been added to the library staff","","","chron96",""
"1969","Librarians status changed from state classified to faculty","","","chron96",""
"1969","Alderman designated a U.S. Regional depository","","July 1969","chron96",""
"1968","Partially automated circulation system implemented","","Feb. 1968","chron96",""
"1969","Associates of the University of Virginia Library founded","","","chron96",""
"1970","Fifteen new positions added","","","chron96",""
"1970","Fiske Kimball Fine Arts Library opens","","Feb. 1970","chron96",""
"1972","Total staff about 87 positions.","","","chron96",""
"1973","Education Library opened","","Sept. 1973","chron96",""
"1973","Major thefts from the Rare Books Room vault discovered","","Dec. 1973","chron96",""
"1994","(23rd) Four-millionth volume added, Rita Dove's ""Lady Freedom Among Us.""","","23 Oct. 1994","chron96",""
"1995","Two new Electronic Centers open in Alderman: the Geographic Information Center and the Special Collections Digital Center","","","chron96",""
"1995","Planning for second generation online catalog begins","","","chron96",""
"1995","University Library World Wide Web page is started","","","chron96",""
"1995","Library's Short Course series begins","","Jan. 1995","chron96",""
"1995","In an effort to free up much needed space, the Library opens Ivy Stacks which now houses over 300,000 seldomly-used materials from all UVA libraries.","","Jan. 1995","chron96",""
"1995","Centennial celebration of the burning of the Rotunda","","Oct. 1995","chron96",""
"1995","Library receives rare book and manuscript collection valued at $25 million and $2.5 million towards new Special Collections Library, as part of $700 million University capital campaign","","Oct. 1995","chron96",""
"1995","Alderman reorganizes as Collection Development is absorbed into two new department- Humanities and Social Sciences Sections","","Nov. 1995","chron96",""
"1996","Digital Media and Music Center opens in Clemons","","Jan. 1996","chron96",""
"1895","comprehensive plan for rebuilding after Rotunda fire","Rotunda after the fire remains the same, aside from a few repairs","four weeks later, Nov/Dec 1895","Clemons 57-8",""
"1895","number of books before the fire: 56,733 to 17,194","but college libraries are all much bigger than 56,733, except W&M which had been destroyed by fire in 1859","Oct. 1895","Clemons 59-60",""
"1895","Books from Rotunda on the Law brought to Brooks Museum","remained until November 1898, card catalog had been saved, but books gone","","Clemons 60",""
"1896","in University Catalog for 1896-7, expect Visitors to allocate money to library","","","Clemons 63",""
"1825","Jefferson achieved a nucleus library ""superior to that of any other previous American college or university at its beginning""","","","Clemons 64",""
"1904","University Catalogue for 1904-05 announces ""more than sixty thousand volumes"" mostly gifts and donations","""This library phoenix that arose from the ashes was a scion of large wingspread, but its body lacked the compact symmetry of its predecessor."" Notable collections icnlude Martin Julius Hertz: classical materials; Thomas Randolph Price: Greek and classical learning; Professor George Frederick Holmes: William Andrews Clark gave money towards this; James Albert Harrison: was English, Romance Languages, and then Teutonic Languages--southern authors esp. Edgar Allen Poe; Frederick Milliam Markey Holliday; Rev. Haslett McKim: bibliography, botany, theology; Barnard Shipp: southern history and development; General Bradley Tyler Johnson: law books; Judge Lambert Tree: law; James Bolton: medical; James L. Leitch: medical; Ormond Stone, Astronomy","","Clemons 64-6",""
"1886","Ormond Stone began to seek astronomical books, making the Library at the observatory excellent","","","Clemons 66-7",""
"1899","Endowment funds, D'Arcy Paul ($1,000: periodicals modern languages) Alfred Henry Byrd ($10,180, later Virginiana)","opened the way for emphasis on research on Southern history with the Lee Papers; Byrd became available in 1900: ""continuing selection and acquisiton of historical, literary, and social material not immediately connected with the undergraduate curriculum""","","Clemons 67",""
"1895-98","reading in Library eliminated","","","Clemons 67",""
"1898","library moved back to Rotunda","increased hours to ten a day, trusted students could search for books on their own(!!)","Nov. 1898","Clemons 68",""
"1903","John Shelton Patton succeeds Frederick Page as librarian","had been Mayor of Charlottesville and Superintendent of Schools; gap between service","appointed June 1903","Clemons 69",""
"1903","salary for Patton $1,150","but continued to develop under the new President","","Clemons 70",""
"1914","Librarian salary $2,000","","","Clemons 70",""
"1921","Librarian salary $3,000","","","Clemons 70",""
"1926","Librarian salary $3,600","","","Clemons 70",""
"1903","first President of UVa: Edwin Anderson Alderman","education expansion, first in NC; ""his primary concern was in the general cultural effect of a Library rather than in the support of college coures or, as yet at least, in research"" (73)","","Clemons 70",""
"1907-1909","First experiment in evening hours for the library","","","Clemons 73",""
"1914","Evening hours added again and successful this time","","","Clemons 73",""
"1903","Assistant Librarian continued with Anna Seeley Tuttle","","","Clemons 73",""
"1911","new course in Library Methods","given by Librarian Patton","Summer Quarter 1911","Clemons 73",""
"1915","second library course added, taught by Asst. Lib. Mary Louise Dinwiddie","a great deal on classification and cataloging of books","","Clemons 74",""
"1857","Librarian Holcombe enjoined to compile author and subject lists by a cataloging method ""devised by Professor Gildersleeve"" and modified by BoV","","","Clemons 74",""
"1904","Department of Graduate Studies organized: Richard Heath Dabney first Dean","","","Clemons 71",""
"1906","Library Committee of the BoV no longer appointed, and Library Committee of the Faculty reported to the President: President decided budgets","","","Clemons 72",""
"1902","John Shelton Patton accepts appointment to be librarian","","Nov. 1902","Clemons 69",""
"1903?","Dewey Decimal Classification adopted","","""then"" ""commendable progress was made by Miss Tuttle"" on the ""second university collection""","Clemons 75",""
"1911-12","Katherine Crenshaw Ricks as Asst. Librarian","","","Clemons 75",""
"1912","Mary Louise Dinwiddie appointed Asst. Libr.","","","Clemons 75",""
"1950","Asst. Libr. Mary Louise Dinwiddie retires after several decades of service","","","Clemons 75",""
"1912","Lilie Estelle Dinwiddie became an Assistant (not Asst. Libr.)","in charge of circulation in 1914","","Clemons 75",""
"1914","Assistant Lilie Estelle Dinwiddie becomes first circulation librarian","remains in post till 1919","","Clemons 75",""
"1901","Herbert Putnam at Library of Congress announces willingness to distribute printed library cards","","","Clemons 76",""
"1909","Faculty Library Committee approved the acquisition of printed library cards from the Library of Congress","","","Clemons 76",""
"1913","beginning of *Bulletin of the University of Virginia Library*","ceases in 1923","","Clemons 76",""
"1917","US enters WWI; UVa becomes like a military training post","professors and students enlisted, significant change; training shifted to Chemistry and Medicine (78)","","Clemons 77",""
"1920","controversy over the Medical Department going to Richmond","","1920-21 session","Clemons 78",""
"1906","donation of books by Grace Dodge of NYC, 1000 vols. for students reading room","","","Clemons 78",""
"1907","gift of books on Geology previously belonging to Jed Hotchkiss, led to establishment of Geology Library in Brooks Museum","","","Clemons 79",""
"1907","donation from bequest of Edward Wilson James of 12,000 books","","","Clemons 79",""
"1908","Dean James Barr Ames of Harvard Law gave ""a long run of the Reports of the English Courts""","","","Clemons 79",""
"1910","French Government, through Ambassador Jusserand, gave works on art, history and literature of France","","","Clemons 79",""
"1911","Judge Lambert Tree of Chicago gave his law books","","","Clemons 79",""
"1912","William David Booker of Baltimore gave books and journals on Pediatrics","","","Clemons 79",""
"1913","Professor Harrison gave books on Southern authors","","","Clemons 79",""
"1913","donation of books from Bennett Wood Green","","","Clemons 79",""
"1913","private collection donated by Wilbur Phelps Morgan, physician of Baltimore, ""bookman of catholic tastes""","continued until his death in 1922, reached well over 10,000 volumes","","Clemons 79",""
"1915","books of Andrew Stevenson, donated by his granddaughter (he had been member of BoV 1845-57, Rector 1856-57)","","","Clemons 79-80",""
"1920","working library of William Harry Heck, prof. of Education donated","","","Clemons 80",""
"1920","establishment in Peabody Hall of the Heck Memorial Library in Education","","","80",""
"1903-11","Anna Tuttle Heck, Asst. Librarian","","","Clemons 80",""
"1921","John Bassett Moore announces his intended gift of law books","continued until 1947 to receive books","","Clemons 80",""
"1922","8,000 vols. given from the private library of William Gordon McCabe, educator and writer","WGM was on BoV from 1887 to 1896; he knew Matthew Arnold, Browning, and Tennyson","","Clemons 80",""
"1922","Judge George Moffett Harrison of Staunton, Va. gave 600 vols","","","Clemons 80",""
"1923","Judge Legh Richmond Watts of Portsmouth, Va. gave 1,400 vols.","","","Clemons 80",""
"1924","Charles Baskerville gave over 1,000 books to Chemistry Lib.","","","Clemons 80",""
"1913","Bible presented by George Wythe to Jefferson given along with NT clipped versions, other Jefferson items too","","","Clemons 81",""
"1895-1925","manuscript items added, mostly Jefferson letters","","","Clemons 81",""
"1921","John H. Ingram collection of Poe acquired by the efforts of Dr. James Southall Wilson","","","Clemons 82",""
"1913","large library donation from Bennett Wood Green's estate","","","Clemons 83",""
"1909","William Whitehead Fuller Fund for the Law Library established","","","Clemons 83",""
"1911","William Barton Rogers Fund for the Physics Library","","","Clemons 83",""
"1911","Lambert Tree Fund for the General Library","","","Clemons 83",""
"1919","Ferrell Dabney Minor, Jr., Memorial Fund for the Law Library","","","Clemons 83",""
"1919","Isabel Mercein Tunstall Fund for books of poetry for the General Library","","","Clemons 83",""
"1920","James Douglas Bruce Fund for English Literature","chiefly used to buy books for graduate library","","Clemons 83",""
"1922","Walter H. Jones Fund for journals for the Engineering Library","","","Clemons 83",""
"1922","Coolidge Fund, est. for Law Library in memory of TJ by the Collidge Family of Boston","","","Clemons 83",""
"1923","Hamilton M. Barksdale Funds for the Chemistry and Engineering Libraries","","","Clemons 83",""
"1907","Robert BAylor Tunstall, Sr., gave money to establish Isabel Mercein Tunstall Collection of Poetry","","","Clemons 83",""
"1912","Arthur Curtiss James gave money for books ""on the Negro""","","","Clemons 83",""
"1919","Paul Goodloe McIntire gave money for books and equipment for Fine Arts","","","Clemons 83",""
"1922","Alfred William Erickson gave money for Education Library","","","Clemons 83-4",""
"1923","anonymous donated money for the General Library","","","Clemons 84",""
"1923","members of Minor Inn of Phi Delta Phi gave money for the purchase of law books in memory of Raleigh Colston Minor","","","Clemons 84",""
"1925","131,422 books reported in the libraries","","June 1925","Clemons 84",""
"1925","thirteen special libraries around Grounds","all sort of independent, subjects, Graduate LIbrary, etc. etc.","","Clemons 84",""
"1917","Chemistry library destroyed by burning of the Chemical Laboratory","","","Clemons 85",""
"1918","new Chemistry Library located in Cobb Chemical Laboratory","","","Clemons 85",""
"1911","Law Library moved to Minor Hall","student librarians that had been elected were made full-time","","Clemons 86",""
"1911","Ella Watson Johnson first appointeed student Law Librarian","","","Clemons 86",""
"1912-45","Catherine Rebecca Lipop appointed Law Librarian","continued until retirement in 1945","","Clemons 86",""
"1925","Law Library had 20,000 vols., largest of separate collections","","","Clemons 86",""
"1917","Librarian Patton reports the Rotunda is inadequate for whole library","","","Clemons 87",""
"1923","John Calvin Metcalf, appointed Chairman af Faculty Library Committee in 1918, appointed Dean of Department of Graduate Studies","case for library as research center reinforced; new concept involved more than just the building, but the building was essential","","",""
"1824","community banquet to Lafayette in Rotunda","","","Clemons 87",""
"1924","Centennial banquet held in Rotunda against objects, compromise was to buy three bookshelves, but established a working relationship","","","Clemons 88",""
"1924","Faculty Library Committee decided piecemeal approach was done and to aim for a new building","","January 1924","Clemons 88",""
"1825","John Vaughan Kean was librarian","recommended by Father, Dr. Andrew Kean to Jefferson","","Clemons 91",""
"1826-1831, 1835-1857, 1865-1881, emeritus 1881-2","William Wertenbaker librarian","holds the record for length of service, worked as a Clerk, later served with a bunch of Rectors and notables from UVa; probably identified by Jefferson, as there's no record of his application to Jefferson: ""Wertenbaker began to take on other income producing occupations, until he had, at one time or another, filled nearly all the positions available at the University except a Professor's chair."" (95): Assistant Proctor, University Postmaster, Bookstore Manager, Secretary of the Faculty, University Hotel Keeper, Secretary of the Board of Visitors; a student was expelled in 1831 for repeated threats to flog Wertenbaker; faculty selected and he purchased","","Clemons 92",""
"1868","Abiel Abbot Low, New York, surprise donates $500","suggested ""such standard works, of permanent value, on History & Biography, Geography & Travels, Religion and General Literature as may be of common interest to all the Professors and especially useful to the students of the University""","November 1868","Clemons 98",""
"1831-35","William Henry Brockenbrough librarian","one definate failure of the first 100 years; appointment made in July to take place in August; lack of success was not lack of ability","","Clemons 101",""
"1857-61","Thomas Beverley Holcombe librarian","","","Clemons 105",""
"1881","size of library, 36,000 books","","","Clemons 97-8",""
"1830","8,000 books","","","Clemons 98",""
"1824","Valentine Wood Southall presided over banquet in Rotunda for Lafayette","","","Clemons 94",""
"1825","books in pavilion on West Lawn, open for students only one hour a week","","","Clemons 91",""
"1861","Older brother of Librarian Holcombe, James Philemon Holcombe, becomes vocal spokesman for Confederacy","","","Clemons 106",""
"1857-1861","Thomas Berkeley Holcombe is librarian","","Sept 1857 - Dec 1861","Clemons 107",""
"1860","Librarian Holcombe was petitioning faculty to let him close library an noon on Saturday so he could travel to Lynchburg for Sunday","wants to keep the sabbath and offers to open the library earlier five days a week, request was granted","","Clemons 107",""
"1861-1865","Robert Riddick Prentis, acting librarian","","Dec 1861 - July 1865","Clemons 108",""
"1953","endowment fund for purchase of books on Ancient Languages, friends of Professor Robert Henning Webb, great great nephew of Librarian Prentis","","","Clemons 110",""
"1882-1886","William Aylett Winston, Librarian","Readjuster [party's] librarian","","Clemons 110",""
"1886-1891","James Biscoe Baker, Librarian","steadfast in a crisis, saved Secretary's files during fire","","Clemons 112",""
"1881-1882, 1891-1903","Frederick Winslow Page, Librarian","Father was Mann Page, who lived in Keswick","","Clemons 115",""
"1903-1927","John Shelton Patton, Librarian","established library bulletin","","Clemons 118",""
"1947","Colgate Whitehead Darden, Jr. takes over as President with a focus on being a state University: preserving people's heritage and contributing to the advancement of knowlege","preservation of freedom, Jeffersonian liberty; begin of major development work","","Clemons 124",""
"1925","Seven full-time members of the Library staff, general in Rotunda, 13 separate collections, 131,422 vols.","including Law Librarian; only 17,194 survived the fire","","Clemons 125",""
"1926","beginning of the Institute for Research in the Social Sciences, org. Professor Wilson Gee, collaborates with Library","","","Clemons 126",""
"1927","Harry Clemons appointed librarian, first granted faculty rank","","","Clemons 127",""
"1930","invitatition for Librarian to present the situation of the library and plans for reorg to University Senate","University Senate new, established in 1926; ten admin, 11 Faculties","October 1930","Clemons 129",""
"1927","Faculty Library Committee had continued to suggest books to be purchased","...continued to this year, began what year?; 30 Schools and Depts would appoint a liaison to communicate","","Clemons 130",""
"1942","Dean Metcalf, Prof. Robert Henning Webb, and Librarian made extensive survey to make it more efficient","","","Clemons 131",""
"1939","Faculty Library Committee voted unanimously to collect ""all sides of all questions, however controversial""","rejecting ""dissemination of propaganda""; ""for research by qualified scholars""","December 1939","Clemons 131",""
"1940","Library Faculty Committee votes to be selective in what it acquires and cooperates; build up the reference collection","""unable to undertake unlimited acceptance"" the formula is simple: ""when in doubt, retain""; call on members of the Library Committee and the University Faculty as a whole for help","April 1940","Clemons 131-2",""
"1929","Presentation to the Faculty Library Committee, total cost of $1 million for building, another million for endowment","Alderman said ""Gentlemen, I have finished with consideration of thirty-seven dollars and fifty cents!""","","Clemons 134",""
"1931","Alderman anounces the need for a ""great structure"" with ""an adequate endowment for its operations""","","13 April 1931","Clemons 133-4",""
"1935","President Newcomb proposed an appeal to Federal Emergency Agency of the Public Works Administration, Faculty Library Committee, BoV, and Governor approved, for a new Library","the procedures changed, but launched a bond issue","","Clemons 136",""
"1938","there were a total of 22 non Rotunda libraries, in seventeen other buildings; Engineering, Law, Medicine; Astronomy, Chemistry, Fine Arts, Geology, Institute for Research in the Social Sciences, Mathematics, Music, Physics, Public Administration, and Rural Social Economics remained outside of Alderman afterward","","","Clemons 138",""
"1935","R.E. Lee Taylor of Taylor and Fisher of Baltimore, volunteered to prepare drawings for new library","later became the architect of the new library","","Clemons 137",""
"1935","article in Atlantic Monthly comparing American University libraries caused discomfort, by Edwin Rogers Embree","","June 1935","Clemons 137",""
"1930","erection of the football stadium made the library seem more urgent","","","Clemons 137",""
"1936","President Newcomb pressed Washington Alumni for help with the library","","January 1936","Clemons 137",""
"1936","Senator Glass and President Newcomb pressed Harold Ickes, Secretary of the Interior and Administrator of Public Works, approved P.W.A. grant (based on bonds)","11:50 telegram to the Architect to keep going","11:44 am, 12 September 1936","Clemons 137",""
"1936","contract for excavation and foundation for Alderman Library","actual work started late in Nov","Nov 1936","Clemons 138",""
"1927","increase of hours from 49 to 84 per week to pay the students who had been volunteering to keep the library open","","","Clemons 128",""
"1876","Frederick Winslow Page appointed Assistant Librarian (later Librarian)","","","Clemons 115",""
"1927","There are 151,333 books counted on shelves, but not counting gifts, etc.","","","Clemons 128",""
"1927","Clemons made a delibrate increase of the cataloging force, they discussed cataloging problems in the oval room in Rotunda","","","Clemons 128",""
"1937","Bonds issued for the construction of Alderman","","January 1937","Clemons 138",""
"1938","original completion date for Alderman Januar 1938, actual March 1938, moved in April 1938","","","Clemons 138",""
"1938","move took 23 working days, main reading room undisturbed except for May 10, new building open on May 11","classification order preserved during the move with special boxes; vols. urgently needed could be located during the whole process","20 April 1938 - 26 May 1938","Clemons 139",""
"1938","formal dedication of Alderman Library, announcement of Tracy W. McGregor Library","","13 June 1938","Clemons 140",""
"after 1938","graduate courses in McGregor Room, seminars on modern prose and poetry with Eng. Dept called McGregor Room Seminars, also BSUVA, Albemarle County Historical Society","""This had carride into the humanities something of the value for science of laboratory work and had helped to give meaning to such vague terms as research and original sources.""","no date, but that room opened in 1938","Clemons 205, 206",""
"1950","twenty issues of Annual Reports of the Archivist=Reports on Historical Collections","","","Clemons 207",""
"1941","University of Virginia Bibliographical Series begins, 9th by 1950","","","Clemons 207",""
"1950","several cooperative undertakings with Rare Book and Manuscript Division","Union Catalog records UVa, Confederate Imprints to Boston Athenaeum, unofficial Confederate publications to UNC, Confederate music to Richard Barksdale Harwell, assisting with Evans American Bibliography, film inventory in Philadelphia, Florida Catalog in Winter Park, 17c books to Yale (Wing), American lit. manu. Dr. Joseph J. Jones, suppl. De Ricci-Wilson Census, to Pollard and Redgrave, ","","Clemons 209",""
"1951","Peters Rushton Seminars started, replacing McGregor Room Seminars","","","Clemons 206",""
"1938","original Alderman included a general reading room, document reading room, newspaper and magazine reading room, resevered reading rooms, and a ""browsing room""","","","Clemons 142",""
"1938","Garnett home library was included at the outset","","","Clemons 142",""
"1938","west wing workrooms, east wing reading rooms in Alderman","","","Clemons 142",""
"1938","Alderman sat 800 readers and 100 staff","","","Clemons 143",""
